GSE43721	"Cellular source and mechanisms of high transcriptome complexity in the mammalian testis (RNA-Seq organs)"	3	3	3	3	1	1	1	GEO	https://www.ncbi.nlm.nih.gov/geo/query/acc.cgi?acc=GSE43721	https://bgee.org/ftp/bgee_v15_0/download/processed_expr_values/rna_seq/Mus_musculus/Mus_musculus_RNA-Seq_read_counts_TPM_FPKM_GSE43721.tsv.gz	"Understanding the extent of genomic transcription and its functional relevance is a central goal in genomics research. However, detailed genome-wide investigations of transcriptome complexities in major mammalian organs and their underlying cellular sources, transcriptional mechanisms, and functional relevance have been scarce. Here we first show, using extensive RNA-seq data, that transcription of both functional and nonfunctional genomic elements is substantially more widespread in the testis than in other organs across representative mammals. By scrutinizing the transcriptomes of all main testicular cell types in the mouse, we then reveal that meiotic spermatocytes and especially post-meiotic round spermatids have remarkably diverse transcriptomes, which explains the high transcriptome complexity of the testis as a whole. The widespread transcriptional activity in spermatocytes and spermatids encompasses protein-coding genes and long noncoding RNA genes but also poorly conserved intergenic sequences, suggesting that much of it is not of immediate functional relevance. Rather, our analyses of genome-wide epigenetic data show that this prevalent transcription, which apparently promoted the birth of new genes during evolution, results from a highly permissive chromatin state during and after meiosis that may ultimately facilitate the replacement of histones by protamines during late spermatogenesis."
ERP000787	"Odom_tRNA_evolution"	3	1	1	1	1	1	1	SRA	https://www.ncbi.nlm.nih.gov/sra/ERP000787	https://bgee.org/ftp/bgee_v15_0/download/processed_expr_values/rna_seq/Mus_musculus/Mus_musculus_RNA-Seq_read_counts_TPM_FPKM_ERP000787.tsv.gz	"NA"
SRP074330	"RNA-Seq analysis of Gtf2ird1 knockout epidermal tissue provides potential insights into molecular mechanisms underpinning Williams-Beuren syndrome"	3	1	1	1	1	1	1	GEO	https://www.ncbi.nlm.nih.gov/geo/query/acc.cgi?acc=SRP074330	https://bgee.org/ftp/bgee_v15_0/download/processed_expr_values/rna_seq/Mus_musculus/Mus_musculus_RNA-Seq_read_counts_TPM_FPKM_SRP074330.tsv.gz	"mRNA sequencing of lip tissue from 3 wild type mice (WT) and 3 Gtf2ird1 knockout mice generated by deep sequencing using Illumina HiSeq 2000 platform at the Ramaciotti Centre for Genomics UNSW."
SRP057141	"Cross-mammal male germ cell epigenomics"	2	2	2	2	1	1	1	SRA	https://www.ncbi.nlm.nih.gov/sra/SRP057141	https://bgee.org/ftp/bgee_v15_0/download/processed_expr_values/rna_seq/Mus_musculus/Mus_musculus_RNA-Seq_read_counts_TPM_FPKM_SRP057141.tsv.gz	"Human, rhesus macaque, mouse, cow, opossum, and chicken"
SRP010955	"Maternal Influence on Exonic CpG Island Methylation in the Developing Hippocampus [RNA-Seq]"	2	1	1	1	1	1	1	GEO	https://www.ncbi.nlm.nih.gov/geo/query/acc.cgi?acc=SRP010955	https://bgee.org/ftp/bgee_v15_0/download/processed_expr_values/rna_seq/Mus_musculus/Mus_musculus_RNA-Seq_read_counts_TPM_FPKM_SRP010955.tsv.gz	"Examined transcriptomes of 5HT1A wild type offspring with 5HT1A wild type/heterozygous mother or 5HT1A KO offspring with 5HT1A of heterozygous/knock out mother"
SRP162729	"Gene expression in day 4 pregnant uterus"	2	1	1	1	1	1	1	SRA	https://www.ncbi.nlm.nih.gov/sra/SRP162729	https://bgee.org/ftp/bgee_v15_0/download/processed_expr_values/rna_seq/Mus_musculus/Mus_musculus_RNA-Seq_read_counts_TPM_FPKM_SRP162729.tsv.gz	"To detect the gene profiles in receptive uterus, two independent uteri are collected from pregnant day 4 mice and subjected to RNA-Seq. After aligned to mouse mm9 by Tophat2, RPKM value was calculated by Edger. Our results show that HMGB1 is one of the most abundant gene in the whole HMG family. The expression of HMGB1 was further confirmed by qPCR, ISH and immunofluorescence. The expression of HMGB1 was found expressed in very cells, indicating the essential role of HMGB1 for reproduction. This RNA-Seq data provides fundamental information for our further physiological study of HMGB1. Overall design: Total RNAs in whole uterus from two independent mouse were extracted by TRIzol and purified by ploy-A before subjected to RNA-Seq by HiSeq2500. The expression of level of each gene is normalized to RPKM."
SRP092128	"Phylogenetic analysis of intron retention in vertebrates"	1	1	1	1	1	1	1	SRA	https://www.ncbi.nlm.nih.gov/sra/SRP092128	https://bgee.org/ftp/bgee_v15_0/download/processed_expr_values/rna_seq/Mus_musculus/Mus_musculus_RNA-Seq_read_counts_TPM_FPKM_SRP092128.tsv.gz	"Our study is detailing new evidence for transcriptomic complexity realized by a mechanism of orchestrated intron retention."
