Experiment ID	Experiment name	Library count	Condition count	Organ-stage count	Organ count	Stage count	Sex count	Strain count	Data source	Data source URL	Bgee normalized data URL	Experiment description
SRP013027	"GSE37909: RNA-seq from ENCODE/Caltech (Mouse)"	97	47	47	12	6	1	1	SRA	https://www.ncbi.nlm.nih.gov/sra/SRP013027	https://bgee.org/ftp/bgee_v15_0/download/processed_expr_values/rna_seq/Mus_musculus/Mus_musculus_RNA-Seq_read_counts_TPM_FPKM_SRP013027.tsv.gz	"Overall Design: Cells were grown according to the approved ENCODE cell culture protocols (http://hgwdev.cse.ucsc.edu/ENCODE/protocols/cell/mouse). Cells were lysed in RLT buffer (Qiagen RNEasy kit), and processed on RNEasy midi columns according to the manufacturer's protocol, with the inclusion of the *on-column* DNAse digestion step to remove residual genomic DNA. A quantity of 75 Âµgs of total RNA was selected twice with oligo-dT beads (Dynal) according to the manufacturer's protocol to isolate mRNA from each of the preparations. A quantity of 100 ngs of mRNA was then processed according to the protocol in Mortazavi et al. (2008), and prepared for sequencing on the Illumina GAIIx or HiSeq platforms according to the protocol for the ChIP-Seq DNA genomic DNA kit (Illumina). Paired-end libraries were size-selected around 200 bp (fragment length). Libraries were sequenced with the Illumina HiSeq according to the manufacturer's recommendations. Paired-end reads of 100 bp length were obtained.Reads were mapped to the reference mouse genome (version mm9 with or without the Y chromosome, depending on the sex of the cell line, and without the random chromosomes in all cases) using TopHat (version 1.3.1) (http://tophat.cbcb.umd.edu/). TopHat was used with default settings with the exception of specifying an empirically determined mean inner-mate distance and supplying known ENSEMBL version 63 splice junctions."
SRP020526	"Mus musculus strain:black6 x castaneus Transcriptome or Gene expression"	61	51	26	26	4	2	2	SRA	https://www.ncbi.nlm.nih.gov/sra/SRP020526	https://bgee.org/ftp/bgee_v15_0/download/processed_expr_values/rna_seq/Mus_musculus/Mus_musculus_RNA-Seq_read_counts_TPM_FPKM_SRP020526.tsv.gz	"RNA-Seq of reciprocally crossed Black6 x CAST hybrid mouse tissues."
ERP104395	"An RNASeq normal tissue atlas for mouse and rat"	38	13	13	13	1	1	1	SRA	https://www.ncbi.nlm.nih.gov/sra/ERP104395	https://bgee.org/ftp/bgee_v15_0/download/processed_expr_values/rna_seq/Mus_musculus/Mus_musculus_RNA-Seq_read_counts_TPM_FPKM_ERP104395.tsv.gz	"The function of a gene is closely connected to its expression specificity across tissues and cell types. RNA-Seq is a powerful quantitative tool to explore genome wide expression. The aim of the present study is to provide a comprehensive RNA-Seq dataset across the same 13 tissues for mouse and rat, two of the most relevant species for biomedical research. The dataset provides the transcriptome across tissues from three male C57BL6 mice and three male Han Wistar rats. We also describe our bioinformatics pipeline to process and technically validate the data. Principal component analysis shows that tissue samples from both species cluster similarly. By comparative genomics we show that many genes with high sequence identity with respect to their human orthologues have also a highly correlated tissue distribution profile and are in agreement with manually curated literature data for human. These results make us confident that the present study provides a unique resource for comparative genomics and will facilitate the analysis of tissue specificity and cross-species conservation in higher organisms."
GSE30617	"[E-MTAB-599] Mouse Transcriptome"	36	6	6	6	1	1	1	GEO	https://www.ncbi.nlm.nih.gov/geo/query/acc.cgi?acc=GSE30617	https://bgee.org/ftp/bgee_v15_0/download/processed_expr_values/rna_seq/Mus_musculus/Mus_musculus_RNA-Seq_read_counts_TPM_FPKM_GSE30617.tsv.gz	"Sequencing the transcriptome of DBAxC57BL/6J mice. To study the regulation of transcription, splicing and RNA turnover we have sequenced the transcriptomes of tissues collected DBAxC57BL/6J mice."
SRP028336	"Large-scale multi-species survey of metabolome and lipidome"	30	10	5	5	1	2	1	SRA	https://www.ncbi.nlm.nih.gov/sra/SRP028336	https://bgee.org/ftp/bgee_v15_0/download/processed_expr_values/rna_seq/Mus_musculus/Mus_musculus_RNA-Seq_read_counts_TPM_FPKM_SRP028336.tsv.gz	"This dataset was generated with the goal of comparative study of gene expression in three brain regions and two non-neural tissues of humans, chimpanzees, macaque monkeys and mice. Using this dataset, we performed studies of gene expression and gene splicing evolution across species and search of tissue-specific gene expression and splicing patterns. We also used the gene expression information of genes encoding metabolic enzymes in this dataset to support a larger comparative study of metabolome evolution in the same set of tissues and species. Overall design: 120 tissue samples of prefrontal cortex (PFC), primary visual cortex (VC), cerebellar cortex (CBC), kidney and skeletal muscle of humans, chimpanzees, macaques and mice. The data accompanies a large set of metabolite measurements of the same tissue samples. Enzyme expression was used to validate metabolite measurement variation among species."
GSE41637	"Evolutionary dynamics of gene and isoform regulation in mammalian tissues"	26	26	9	9	1	2	3	GEO	https://www.ncbi.nlm.nih.gov/geo/query/acc.cgi?acc=GSE41637	https://bgee.org/ftp/bgee_v15_0/download/processed_expr_values/rna_seq/Mus_musculus/Mus_musculus_RNA-Seq_read_counts_TPM_FPKM_GSE41637.tsv.gz	"Most mammalian genes produce multiple distinct mRNAs through alternative splicing, but the extent of splicing conservation is not clear. To assess tissue-specific transcriptome variation across mammals, we sequenced cDNA from 9 tissues from 4 mammals and one bird in biological triplicate, at unprecedented depth. We find that while tissue-specific gene expression programs are largely conserved, alternative splicing is well conserved in only a subset of tissues and is frequently lineage-specific. Thousands of novel, lineage-specific and conserved alternative exons were identified; widely conserved alternative exons had signatures of binding by MBNL, PTB, RBFOX, STAR and TIA family splicing factors, implicating them as ancestral mammalian splicing regulators. Our data also indicates that alternative splicing is often used to alter protein phosphorylatability, delimiting the scope of kinase signaling."
SRP104670	"Diurnal liver transcriptome in wt and nono-/- mice"	24	1	1	1	1	1	1	SRA	https://www.ncbi.nlm.nih.gov/sra/SRP104670	https://bgee.org/ftp/bgee_v15_0/download/processed_expr_values/rna_seq/Mus_musculus/Mus_musculus_RNA-Seq_read_counts_TPM_FPKM_SRP104670.tsv.gz	"Overall design: Livers were collected at 12 different time points during a 24h day (ZT0-ZT22). For each liver sample, total and nuclear RNA were extracted for a total of 48 samples. Each sample is a pool of 2 mice."
ERP012910	"Transcriptome sequencing of three tissues and ten taxa related to the house mouse Mus musculus."	23	17	3	3	1	1	6	SRA	https://www.ncbi.nlm.nih.gov/sra/ERP012910	https://bgee.org/ftp/bgee_v15_0/download/processed_expr_values/rna_seq/Mus_musculus/Mus_musculus_RNA-Seq_read_counts_TPM_FPKM_ERP012910.tsv.gz	"We sampled brain, liver and testis from populations, subspecies and species closely related to Mus musculus, spanning approximately between 3000 years and 10 million years of divergence."
SRP114436	"Hepatic transcriptome by Next Generation Sequencing of WT and clock mutant mice fed a HFD ad libitum or time-restricted feeding."	23	1	1	1	1	1	1	SRA	https://www.ncbi.nlm.nih.gov/sra/SRP114436	https://bgee.org/ftp/bgee_v15_0/download/processed_expr_values/rna_seq/Mus_musculus/Mus_musculus_RNA-Seq_read_counts_TPM_FPKM_SRP114436.tsv.gz	"Overall design: Circadian time course of liver mRNA profile of WT, Bmal1-liverKO, Rev-erba/ÃŸ-liverdoubleKO, Cry1Cry2 double KO after 12 weeks of high fat diet feeding ad libitum or time-restricted feeding"
GSE30352	"The evolution of gene expression levels in mammalian organs"	17	17	6	6	1	2	2	GEO	https://www.ncbi.nlm.nih.gov/geo/query/acc.cgi?acc=GSE30352	https://bgee.org/ftp/bgee_v15_0/download/processed_expr_values/rna_seq/Mus_musculus/Mus_musculus_RNA-Seq_read_counts_TPM_FPKM_GSE30352.tsv.gz	"Changes in gene expression are thought to underlie many of the phenotypic differences between species. However, large-scale analyses of gene expression evolution were until recently prevented by technological limitations. Here we report the sequencing of polyadenylated RNA from six organs across ten species that represent all major mammalian lineages (placentals, marsupials and monotremes) and birds (the evolutionary outgroup), with the goal of understanding the dynamics of mammalian transcriptome evolution. We show that the rate of gene expression evolution varies among organs, lineages and chromosomes, owing to differences in selective pressures: transcriptome change was slow in nervous tissues and rapid in testes, slower in rodents than in apes and monotremes, and rapid for the X chromosome right after its formation. Although gene expression evolution in mammals was strongly shaped by purifying selection, we identify numerous potentially selectively driven expression switches, which occurred at different rates across lineages and tissues and which probably contributed to the specific organ biology of various mammals. Our transcriptome data provide a valuable resource for functional and evolutionary analyses of mammalian genomes."
SRP061644	"The relationship between gene network structure and expression variation among individuals and species"	17	6	6	2	3	1	1	SRA	https://www.ncbi.nlm.nih.gov/sra/SRP061644	https://bgee.org/ftp/bgee_v15_0/download/processed_expr_values/rna_seq/Mus_musculus/Mus_musculus_RNA-Seq_read_counts_TPM_FPKM_SRP061644.tsv.gz	"Variation among individuals is a prerequisite of evolution by natural selection. As such, identifying the origins of variation is a fundamental goal of biology. We investigated the link between gene interactions and variation in gene expression among individuals and species, using the mammalian limb as a model system. We first built interaction networks for key genes regulating early (outgrowth; E9.5-11) and late (expansion and elongation; E11-13) limb development in mouse. This resulted in an Early (ESN) and Late (LSN) Stage Network. Computational perturbations of these networks suggest that the ESN is more robust. We then quantified levels of the same key genes among mouse individuals, and found that they vary less at earlier limb stages and that variation in gene expression is heritable. Finally, we quantified variation in gene expression levels among four mammals with divergent limbs (bat, opossum, mouse and pig), and found that levels vary less among species at earlier limb stages. We also found that variation in gene expression levels among individuals and species are correlated for earlier and later limb development. In conclusion, results are consistent with the robustness of the ESN buffering among-individual variation in gene expression levels early in mammalian limb development, and constraining the evolution of early limb development among mammalian species. Overall design: Bat, mouse, opossum, and pig mRNA profiles at early and late developmental stages on each species fore and hind-limbs . Various replicates of each library were generated by single-end sequencing using Illumina HiSeq 2500. Please note that the De novo transcriptome assembly for bat (Trinity.fasta) was generated from pooled RNA-seq data of fore and hind-limbs at various embryonic developmental stages; Beginning stage (Wanek stage 2: 3 FL and 3 HL samples), early-stage (Wanek stage 3/4: 2 FL and 2 HL samples), and late_stage (Wanke stage 6: 2 FL and 2 HL samples)."
SRP048535	"Transcriptional changes in the aging mouse hippocampus (RNA-seq)"	17	2	2	1	2	1	1	SRA	https://www.ncbi.nlm.nih.gov/sra/SRP048535	https://bgee.org/ftp/bgee_v15_0/download/processed_expr_values/rna_seq/Mus_musculus/Mus_musculus_RNA-Seq_read_counts_TPM_FPKM_SRP048535.tsv.gz	"We sequenced mRNA from three age groups (3months (3M), 24 months (24M) and 29 months (29M)) from the full hippocampus Overall design: There were two independent experiments: 3M vs 24M (n=5 to 6, single-end sequencing) and 3M vs 29M (n=3, paired-end sequencing))"
SRP013825	"Transcriptomes of germinal zones of human and mouse fetal neocortex suggest a role of extracellular matrix in progenitor self-renewal."	15	3	3	3	1	1	1	GEO	https://www.ncbi.nlm.nih.gov/geo/query/acc.cgi?acc=SRP013825	https://bgee.org/ftp/bgee_v15_0/download/processed_expr_values/rna_seq/Mus_musculus/Mus_musculus_RNA-Seq_read_counts_TPM_FPKM_SRP013825.tsv.gz	"Total RNA was isolated from the VZ, inner SVZ (ISVZ), outer SVZ (OSVZ) and CP of six 13-16 weeks post-conception (w.p.c.) human fetuses and from the VZ, SVZ and CP of five E14.5 mouse embryos using laser capture microdissection of Nissl-stained cryosections of dorsolateral telencephalon. Poly A+ RNA was used as template for the preparation of cDNA which were then subjected to single-end 76-bp RNA-Seq."
SRP022612	"RNA-seq of Danio rerio and Mus musculus skin for three different age groups"	15	3	3	1	3	1	1	GEO	https://www.ncbi.nlm.nih.gov/geo/query/acc.cgi?acc=SRP022612	https://bgee.org/ftp/bgee_v15_0/download/processed_expr_values/rna_seq/Mus_musculus/Mus_musculus_RNA-Seq_read_counts_TPM_FPKM_SRP022612.tsv.gz	"Comparison of temporal gene expression profiles (www.jenage.de) The RNA-seq data comprises 3 age groups: 2, 15 and 30 months for mouse skin; 5, 24 and 42 months for zebrafish skin. Illumina 50bp single-stranded single-read RNA sequencing Overall design: 15 samples for mouse: 5 biological replicates for 2 months, 6 biological replicates for 15 months and 4 biological replicates for 30 months; 20 samples for zebrafish: 9 biological replicates for 5 months, 6 biological replicates for 24 months and 5 biological replicates for 42 months"
SRP135698	"Representation and relative abundance of cell-type selective markers in whole-kidney RNA-Seq data"	15	2	2	2	1	1	1	SRA	https://www.ncbi.nlm.nih.gov/sra/SRP135698	https://bgee.org/ftp/bgee_v15_0/download/processed_expr_values/rna_seq/Mus_musculus/Mus_musculus_RNA-Seq_read_counts_TPM_FPKM_SRP135698.tsv.gz	"Purpose: We used RNA-seq to determine the mRNA species and cell types presented in the whole kidney tissue. Methods: We extracted RNA from the whole kidney tissue and microdissected proximal tubules. cDNA libraries were constructed for paired-end sequencing and sequenced on Illumina HiSeq3000 platform.Reads were mapped to mouse Ensembl Genome by STAR and transcript abundances were calculated in the units of transcripts per million (TPM) using RSEM (https://github.com/deweylab/RSEM). Results and conclusion: Based on a variety of data types we curated a list of 43 cell types that are thought to exist in the kidney. Our data indicated that, If mRNA levels parallel protein levels, the contribution of proximal tubules to total mRNA in the renal tubule is also likely to be in the vicinity of 66%. Overall design: cDNAs from whole kidney tissue and microdissected proximal tubules were generated and sequenced using Illumina HiSeq 3000."
SRP045471	"A relative shift in cloacal location repositions external genitalia in amniote evolution"	12	6	6	4	4	1	1	GEO	https://www.ncbi.nlm.nih.gov/geo/query/acc.cgi?acc=SRP045471	https://bgee.org/ftp/bgee_v15_0/download/processed_expr_values/rna_seq/Mus_musculus/Mus_musculus_RNA-Seq_read_counts_TPM_FPKM_SRP045471.tsv.gz	"RNA-seq profiling of embryonic limb and external genitalia tissue at different stages of development, in mouse and anole lizard, in duplicates, using Illumina HiSeq"
SRP058709	"Transcriptome Profiling of Developing Murine Lens through RNA Sequencing"	12	5	5	1	5	1	1	GEO	https://www.ncbi.nlm.nih.gov/geo/query/acc.cgi?acc=SRP058709	https://bgee.org/ftp/bgee_v15_0/download/processed_expr_values/rna_seq/Mus_musculus/Mus_musculus_RNA-Seq_read_counts_TPM_FPKM_SRP058709.tsv.gz	"Whole transcrtiome and microRNA profilling of mouse lens using 2 embryonic (E15 and E18) and 4 postnatal stages (P0, P3, P6 and P9) in duplicates through high-throughput sequening using Illumina HiSeq2000."
GSE43520	"The evolution of lncRNA repertoires and expression patterns in tetrapods"	9	6	5	4	2	2	2	GEO	https://www.ncbi.nlm.nih.gov/geo/query/acc.cgi?acc=GSE43520	https://bgee.org/ftp/bgee_v15_0/download/processed_expr_values/rna_seq/Mus_musculus/Mus_musculus_RNA-Seq_read_counts_TPM_FPKM_GSE43520.tsv.gz	"To broaden our understanding of lncRNA evolution, we used an extensive RNA-seq dataset to establish lncRNA repertoires and homologous gene families in 11 tetrapod species. We analyzed the poly- adenylated transcriptomes of 8 organs (cortex/whole brain without cerebellum, cerebellum, heart, kidney, liver, placenta, ovary and testis) and 11 species (human, chimpanzee, bonobo, gorilla, orangutan, macaque, mouse, opossum, platypus, chicken and the frog Xenopus tropicalis), which shared a common ancestor ~370 millions of years (MY) ago. Our dataset included 47 strand-specific samples, which allowed us to confirm the orientation of gene predictions and to address the evolution of sense-antisense transcripts. See also GSE43721 (Soumillon et al, Cell Reports, 2013) for three strand-specific samples for mouse brain, liver and testis."
SRP086707	"Transcriptional profiling of mouse and hamster oocytes"	9	3	3	3	2	2	1	SRA	https://www.ncbi.nlm.nih.gov/sra/SRP086707	https://bgee.org/ftp/bgee_v15_0/download/processed_expr_values/rna_seq/Mus_musculus/Mus_musculus_RNA-Seq_read_counts_TPM_FPKM_SRP086707.tsv.gz	"We profiled transcriptomes from mouse GV, MII oocytes and 1 cell embryos and Hamster oocytes. Overall design: Examination of gene expression in different stages of oogenesis and early development"
GSE43013	"Gene Expression Defines Natural Changes in Mammalian Lifespan"	9	3	3	3	1	1	1	GEO	https://www.ncbi.nlm.nih.gov/geo/query/acc.cgi?acc=GSE43013	https://bgee.org/ftp/bgee_v15_0/download/processed_expr_values/rna_seq/Mus_musculus/Mus_musculus_RNA-Seq_read_counts_TPM_FPKM_GSE43013.tsv.gz	"RNA-seq gene expression profiling in normal liver, kidney and brain of 33 mammalian species."
GSE41338	"The evolutionary landscape of alternative splicing in vertebrate species"	6	5	5	5	1	1	1	GEO	https://www.ncbi.nlm.nih.gov/geo/query/acc.cgi?acc=GSE41338	https://bgee.org/ftp/bgee_v15_0/download/processed_expr_values/rna_seq/Mus_musculus/Mus_musculus_RNA-Seq_read_counts_TPM_FPKM_GSE41338.tsv.gz	"How species with similar repertoires of protein coding genes differ so dramatically at the phenotypic level is poorly understood. From comparing the transcriptomes of multiple organs from vertebrate species spanning ~350 million years of evolution, we observe significant differences in alternative splicing complexity between the main vertebrate lineages, with the highest complexity in the primate lineage. Moreover, within as little as six million years, the splicing profiles of physiologically-equivalent organs have diverged to the extent that they are more strongly related to the identity of a species than they are to organ type. Most vertebrate species-specific splicing patterns are governed by the highly variable use of a largely conserved cis-regulatory code. However, a smaller number of pronounced species-dependent splicing changes are predicted to remodel interactions involving factors acting at multiple steps in gene regulation. These events are expected to further contribute to the dramatic diversification of alternative splicing as well as to other gene regulatory changes that contribute to phenotypic differences among vertebrate species."
SRP058740	"Analysis of human, chimpanzee, macaque and mouse tissue transcriptomes using Next Generation Sequencing"	6	4	4	4	1	1	1	SRA	https://www.ncbi.nlm.nih.gov/sra/SRP058740	https://bgee.org/ftp/bgee_v15_0/download/processed_expr_values/rna_seq/Mus_musculus/Mus_musculus_RNA-Seq_read_counts_TPM_FPKM_SRP058740.tsv.gz	"We performed deep strand-specific sequencing of poly-adenylated RNA (polyA+ RNAseq) from human, chimpanzee, macaque and mouse tissues, with the goal of detecting numerous non-annotated poorly expressed and antisense genes. We identified thousands of annotated and novel genes, especially in testis. We discovered that ~2% of the human and chimpanzee multiexonic genes were specific from such species. Overall design: We generated RNA-Seq data (~2.10 billion paired-end reads, 25-100 bp length) for the polyadenylated RNA fraction of brain (cerebral cortex), heart, liver and testis. In human and chimpanzee, we generated 2 samples per tissue corresponding to different individuals. In macaque, only 1 sample per tissue was generated. In mouse, considered as the evolutionary outgroup, we generated three pools of brain samples, and one pool of heart, liver and testis samples. We generated an additional sample in Testis without including reverse transcriptase as a control of DNA contamination."
SRP053433	"Combining ChIP-Seq and RNA-Seq data in early placental development to study trophoblast invasion [RNA-Seq]"	6	2	2	2	2	2	1	GEO	https://www.ncbi.nlm.nih.gov/geo/query/acc.cgi?acc=SRP053433	https://bgee.org/ftp/bgee_v15_0/download/processed_expr_values/rna_seq/Mus_musculus/Mus_musculus_RNA-Seq_read_counts_TPM_FPKM_SRP053433.tsv.gz	"RNA-Seq at two time points in early placenta development (e7.5 an e9.5). There are 3 biological replicates per time point. Samples were pooled and sequenced on two lanes."
SRP092799	"Testing the Ret and Sema3d genetic interaction in mouse enteric nervous system development"	6	2	1	1	1	2	1	GEO	https://www.ncbi.nlm.nih.gov/geo/query/acc.cgi?acc=SRP092799	https://bgee.org/ftp/bgee_v15_0/download/processed_expr_values/rna_seq/Mus_musculus/Mus_musculus_RNA-Seq_read_counts_TPM_FPKM_SRP092799.tsv.gz	"poly-A RNA-seq in embryonic day 12.5 mouse gut from 3 wildtype males, 3 wildtype females, 3 Ret null homozyogote males, 3 Ret null homozyogote females, 3 Sema3d null homozyogote males, 3 Sema3d null homozyogote females, 3 Ret-Sema3d double null homozyogote males, 3 Ret-Sema3d double null homozyogote females"
SRP007359	"Digital gene expression and global mapping of polyadenylation sites with PolyA-Seq"	5	5	5	5	4	2	1	SRA	https://www.ncbi.nlm.nih.gov/sra/SRP007359	https://bgee.org/ftp/bgee_v15_0/download/processed_expr_values/rna_seq/Mus_musculus/Mus_musculus_RNA-Seq_read_counts_TPM_FPKM_SRP007359.tsv.gz	"We describe PolyA-Seq, a strand-specific method for high-throughput sequencing of the 3' ends of polyadenylated transcripts. PolyA-Seq is as accurate for digital gene expression as existing RNA sequencing approaches, and superior to microarrays. We used the approach to map polyadenylation (polyA) sites in 24 samples from normal tissues in human, rhesus, dog, mouse, and rat. Overall design: Detection of polyA sites in a mixture of 24 tissues in human, mouse, rat, dog and rhesus. Samples included two replicates each of MAQC Human Brain Reference and MAQC Universal Human Reference. Two additional human sets of reads are included that were used to distinguish true polyA sites from internal priming sites."
SRP070644	"Next Generation Sequencing Facilitates Quantitative Analysis of Wild Type Young and Old muscle Transcriptomes"	4	2	2	1	2	1	1	SRA	https://www.ncbi.nlm.nih.gov/sra/SRP070644	https://bgee.org/ftp/bgee_v15_0/download/processed_expr_values/rna_seq/Mus_musculus/Mus_musculus_RNA-Seq_read_counts_TPM_FPKM_SRP070644.tsv.gz	"Overall design: Muscle mRNA profiles of 3-month old wild type (WT young) and 20-month old wild type mice (WT Old) were generated by deep sequencing, in triplicate, using Illumina HiSeq 3000."
SRP007655	"Comparative Analysis of RNA-Seq Alignment Algorithms and the RNA-Seq Unified Mapper (RUM)."	4	1	1	1	1	1	1	GEO	https://www.ncbi.nlm.nih.gov/geo/query/acc.cgi?acc=SRP007655	https://bgee.org/ftp/bgee_v15_0/download/processed_expr_values/rna_seq/Mus_musculus/Mus_musculus_RNA-Seq_read_counts_TPM_FPKM_SRP007655.tsv.gz	"RNA-Seq of mouse retinal RNA, as described."
SRP008743	"PrimSeq"	4	1	1	1	1	1	1	SRA	https://www.ncbi.nlm.nih.gov/sra/SRP008743	https://bgee.org/ftp/bgee_v15_0/download/processed_expr_values/rna_seq/Mus_musculus/Mus_musculus_RNA-Seq_read_counts_TPM_FPKM_SRP008743.tsv.gz	"RNA Sequencing of 12 primates and 4 mammals."
SRP045673	"An alternative pluripotent state confers interspecies chimaeric competency [RNA-Seq]"	4	1	1	1	1	1	1	SRA	https://www.ncbi.nlm.nih.gov/sra/SRP045673	https://bgee.org/ftp/bgee_v15_0/download/processed_expr_values/rna_seq/Mus_musculus/Mus_musculus_RNA-Seq_read_counts_TPM_FPKM_SRP045673.tsv.gz	"Here we show that by simple modulation of extrinsic signaling pathways, a new class of pluripotent stem cells, referred to as region selective epiblast stem cells (rsEpiSCs), could be efficiently derived from different stages of the early embryo. rsEpiSCs share features of primed pluripotency yet are distinct from EpiSCs in their molecular characteristics and ability to colonize post-implantation embryos. We performed RNA-sequencing experiments and examined the global gene expression profiles of EpiSCs, rsEpiSCs, in vivo isolated four regions of E6.5 mouse epiblasts: AP (anterior-proximal), AD (anterior-distal), PP (posterior-proximal) and PD (posterior-distal), human H1 ESCs, H1 rsESCs, H9 ESCs, H9 rsESCs, rhesus monkey ORMES23 rsESCs, and chimpanzee rsiPSCs. Overall design: Examination of global gene expression profiles in 2 pluripotent stem cell types across multiple species."
